{
  "schema_version": "chatbot_sft_snapshot_v1",
  "snapshot_id": "sft_snap_tradeoff_explanation_001",
  "data_type": "tradeoff_explanation",
  "created_at": "2026-06-02T00:00:00+09:00",
  "language": "ko",
  "fixture_policy": {
    "is_synthetic_fixture": true,
    "is_training_example": false,
    "human_review_required": true
  },
  "source_policy": {
    "allowed_sources": [
      "recommendation-service purchase option output",
      "recommendation-service venue snapshot metadata",
      "recommendation-service price and distance facts"
    ],
    "disallowed_sources": [
      "direct map database rows",
      "unverified live inventory",
      "route time from model memory",
      "new price estimates"
    ],
    "pii_status": "no_pii",
    "raw_data_policy": "Only synthetic recommendation snapshot facts are present.",
    "ranking_policy": "Assistant may compare trade-offs but must not create new option labels or reorder ranked options."
  },
  "user_request": {
    "text_ko": "가까운 곳이랑 싼 곳 비교해줘.",
    "intent": "compare_purchase_options",
    "requires_location": true
  },
  "grounded_context": {
    "profile": {
      "status": "active",
      "profile_revision": 41,
      "summary_ko": "가격, 거리, 분위기를 함께 비교하려는 사용자입니다.",
      "preferred_categories": [
        "whiskey",
        "bar"
      ],
      "budget": "30k_100k"
    },
    "recommendations": [
      {
        "type": "purchase_option",
        "rank": 1,
        "option_type": "nearest_reasonable",
        "tradeoff_type": "closer_but_more_expensive",
        "place_id": "fixture_place_trade_001_001",
        "place_name": "Fixture Near Bar",
        "beverage_name": "Fixture Bourbon Whiskey",
        "distance_m": 240,
        "price_krw": 52000,
        "atmosphere": "캐주얼하고 활기찬 분위기",
        "availability_status": "likely_available",
        "inventory_confidence": 0.82,
        "price_confidence": 0.82,
        "reason_codes": [
          "NEAREST_REASONABLE",
          "WITHIN_BUDGET"
        ],
        "explanation": "가장 가까운 후보지만 가격이 더 높습니다."
      },
      {
        "type": "purchase_option",
        "rank": 2,
        "option_type": "best_price",
        "tradeoff_type": "farther_but_cheaper",
        "place_id": "fixture_place_trade_001_002",
        "place_name": "Fixture Value Shop",
        "beverage_name": "Fixture Bourbon Whiskey",
        "distance_m": 1180,
        "price_krw": 39000,
        "atmosphere": "구매 중심의 조용한 매장 분위기",
        "availability_status": "likely_available",
        "inventory_confidence": 0.88,
        "price_confidence": 0.88,
        "reason_codes": [
          "BEST_PRICE",
          "WITHIN_BUDGET"
        ],
        "explanation": "더 멀지만 가격이 낮은 후보입니다."
      }
    ],
    "missing_facts": [],
    "used_sources": [
      {
        "source_type": "purchase_option_recommendation",
        "source_service": "recommendation-service",
        "request_id": "fixture_rec_req_purchase_option_recommendation_001",
        "result_id": "fixture_rec_result_purchase_option_recommendation_001",
        "scoring_config_version": "fixture_scoring_v1",
        "profile_revision": 41
      }
    ]
  },
  "expected_assistant_behavior": {
    "answer_ko": "가까운 선택지는 Fixture Near Bar입니다. 240m로 가장 가깝지만 가격은 52,000원입니다. 가격을 우선하면 Fixture Value Shop이 39,000원으로 더 낮지만 1,180m로 더 멉니다.",
    "refused": false,
    "refusal_reason": "",
    "must_include": [
      "Fixture Near Bar",
      "240",
      "52,000원",
      "Fixture Value Shop"
    ],
    "must_not_include": [
      "새로운 장소",
      "새로운 가격",
      "도보 시간",
      "실시간 재고 확정"
    ],
    "preserve_recommendation_order": true,
    "notes": "Expected answer must disclose uncertainty when confidence or freshness is weak."
  },
  "human_review": {
    "status": "draft",
    "reviewer": "",
    "notes": "Synthetic trade-off fixture for manual review.",
    "risk_flags": []
  }
}
