{
  "schema_version": "chatbot_sft_snapshot_v1",
  "snapshot_id": "sft_snap_out_of_scope_refusal_004",
  "data_type": "out_of_scope_refusal",
  "created_at": "2026-06-02T00:00:00+09:00",
  "language": "ko",
  "fixture_policy": {
    "is_synthetic_fixture": true,
    "is_training_example": false,
    "human_review_required": true
  },
  "source_policy": {
    "allowed_sources": [
      "assistant scope policy"
    ],
    "disallowed_sources": [
      "web search",
      "model memory",
      "weather API",
      "medical advice source",
      "unrelated external facts"
    ],
    "pii_status": "no_pii",
    "raw_data_policy": "No recommendation or user data is required for out-of-scope refusal.",
    "ranking_policy": "No recommendation ranking is involved."
  },
  "user_request": {
    "text_ko": "서울 여행 코스 짜줘.",
    "intent": "out_of_scope",
    "requires_location": false
  },
  "grounded_context": {
    "profile": {
      "status": "not_required",
      "profile_revision": null,
      "summary_ko": ""
    },
    "recommendations": [],
    "missing_facts": [],
    "used_sources": [
      {
        "source_type": "assistant_policy",
        "source_service": "recommendation-service-docs",
        "policy": "assistant_scope_policy"
      }
    ]
  },
  "expected_assistant_behavior": {
    "answer_ko": "일반 여행 코스는 도와드릴 수 없습니다. ONTHEBLOCK에서 지원하는 술 추천, 취향 설명, 주변 바나 펍 추천 질문으로 바꿔 주세요.",
    "refused": true,
    "refusal_reason": "out_of_scope",
    "must_include": [
      "ONTHEBLOCK"
    ],
    "must_not_include": [
      "추천 후보",
      "가격",
      "거리",
      "외부 검색 결과",
      "날씨 정보"
    ],
    "preserve_recommendation_order": true,
    "notes": "Expected answer must politely refuse and redirect to ONTHEBLOCK-supported scope."
  },
  "human_review": {
    "status": "draft",
    "reviewer": "",
    "notes": "Synthetic out-of-scope refusal fixture for manual review.",
    "risk_flags": []
  }
}
