{
  "schema_version": "chatbot_sft_snapshot_v1",
  "snapshot_id": "sft_snap_venue_recommendation_explanation_004",
  "data_type": "venue_recommendation_explanation",
  "created_at": "2026-06-02T00:00:00+09:00",
  "language": "ko",
  "fixture_policy": {
    "is_synthetic_fixture": true,
    "is_training_example": false,
    "human_review_required": true
  },
  "source_policy": {
    "allowed_sources": [
      "recommendation-service venue recommendation output",
      "recommendation-service map/place read-model snapshot",
      "recommendation-service reason codes"
    ],
    "disallowed_sources": [
      "direct map database rows",
      "Kakao response data outside approved policy",
      "auth tokens",
      "model memory"
    ],
    "pii_status": "no_pii",
    "raw_data_policy": "Only synthetic recommendation read-model facts are present.",
    "ranking_policy": "Assistant must preserve venue ranking and must not invent place facts."
  },
  "user_request": {
    "text_ko": "입문자가 가기 좋은 바 추천해줘.",
    "intent": "find_nearby_venue",
    "requires_location": true
  },
  "grounded_context": {
    "profile": {
      "status": "active",
      "profile_revision": 34,
      "summary_ko": "입문자 친화적이고 강한 향보다 부드러운 메뉴를 선호합니다.",
      "preferred_categories": [
        "bar",
        "pub"
      ],
      "budget": "30k_100k"
    },
    "recommendations": [
      {
        "type": "venue",
        "rank": 1,
        "place_id": "fixture_place_venue_004_001",
        "name_en": "Fixture Starter Bar",
        "display_name_ko": "픽스처 스타터 바",
        "place_name": "Fixture Starter Bar",
        "place_type": "bar",
        "distance_m": 600,
        "atmosphere": "조용하고 직원 설명을 받기 쉬운 분위기",
        "menu": [
          "하이볼",
          "크림 리큐르"
        ],
        "price_range": "12000-25000",
        "availability_status": "likely_available",
        "inventory_confidence": 0.77,
        "price_confidence": 0.78,
        "reason_codes": [
          "BEGINNER_FRIENDLY",
          "GOOD_ATMOSPHERE"
        ],
        "explanation": "입문자 친화적인 메뉴와 차분한 분위기가 잘 맞습니다."
      },
      {
        "type": "venue",
        "rank": 2,
        "place_id": "fixture_place_venue_004_002",
        "name_en": "Fixture Classic Pub",
        "display_name_ko": "픽스처 클래식 펍",
        "place_name": "Fixture Classic Pub",
        "place_type": "pub",
        "distance_m": 740,
        "atmosphere": "캐주얼하고 메뉴 선택지가 넓은 분위기",
        "menu": [
          "라거",
          "진토닉"
        ],
        "price_range": "10000-22000",
        "availability_status": "likely_available",
        "inventory_confidence": 0.8,
        "price_confidence": 0.78,
        "reason_codes": [
          "BEGINNER_FRIENDLY",
          "NEARBY_VENUE"
        ],
        "explanation": "편하게 시작하기 좋은 대안입니다."
      }
    ],
    "missing_facts": [],
    "used_sources": [
      {
        "source_type": "venue_recommendation",
        "source_service": "recommendation-service",
        "request_id": "fixture_rec_req_venue_recommendation_004",
        "result_id": "fixture_rec_result_venue_recommendation_004",
        "scoring_config_version": "fixture_scoring_v1",
        "profile_revision": 34
      }
    ]
  },
  "expected_assistant_behavior": {
    "answer_ko": "입문자 기준이면 Fixture Starter Bar가 가장 좋습니다. 600m 거리이고 직원 설명을 받기 쉬운 분위기와 입문자 친화적인 메뉴가 맞습니다. 조금 더 캐주얼한 대안은 Fixture Classic Pub입니다.",
    "refused": false,
    "refusal_reason": "",
    "must_include": [
      "Fixture Starter Bar",
      "입문자",
      "600m",
      "Fixture Classic Pub"
    ],
    "must_not_include": [
      "새로운 장소 이름",
      "영업 중 확정",
      "실시간 재고 확정",
      "도보 시간",
      "추천 순서 변경"
    ],
    "preserve_recommendation_order": true,
    "notes": "Expected answer must preserve venue ranking and avoid live availability claims."
  },
  "human_review": {
    "status": "draft",
    "reviewer": "",
    "notes": "Synthetic venue recommendation fixture for manual review.",
    "risk_flags": []
  }
}
