{
  "schema_version": "chatbot_sft_snapshot_v1",
  "snapshot_id": "sft_snap_tradeoff_explanation_002",
  "data_type": "tradeoff_explanation",
  "created_at": "2026-06-02T00:00:00+09:00",
  "language": "ko",
  "fixture_policy": {
    "is_synthetic_fixture": true,
    "is_training_example": false,
    "human_review_required": true
  },
  "source_policy": {
    "allowed_sources": [
      "recommendation-service purchase option output",
      "recommendation-service venue snapshot metadata",
      "recommendation-service price and distance facts"
    ],
    "disallowed_sources": [
      "direct map database rows",
      "unverified live inventory",
      "route time from model memory",
      "new price estimates"
    ],
    "pii_status": "no_pii",
    "raw_data_policy": "Only synthetic recommendation snapshot facts are present.",
    "ranking_policy": "Assistant may compare trade-offs but must not create new option labels or reorder ranked options."
  },
  "user_request": {
    "text_ko": "분위기 좋은 곳이랑 가격 좋은 곳 중 뭐가 나아?",
    "intent": "compare_purchase_options",
    "requires_location": true
  },
  "grounded_context": {
    "profile": {
      "status": "active",
      "profile_revision": 42,
      "summary_ko": "가격, 거리, 분위기를 함께 비교하려는 사용자입니다.",
      "preferred_categories": [
        "whiskey",
        "bar"
      ],
      "budget": "30k_100k"
    },
    "recommendations": [
      {
        "type": "purchase_option",
        "rank": 1,
        "option_type": "balanced_best",
        "tradeoff_type": "better_atmosphere_but_stale_price",
        "place_id": "fixture_place_trade_002_001",
        "place_name": "Fixture Mood Lounge",
        "beverage_name": "Fixture Bourbon Whiskey",
        "distance_m": 680,
        "price_krw": 46000,
        "atmosphere": "조용하고 고급스러운 라운지 분위기",
        "availability_status": "likely_available",
        "inventory_confidence": 0.54,
        "price_confidence": 0.54,
        "reason_codes": [
          "BALANCED_BEST",
          "WITHIN_BUDGET"
        ],
        "explanation": "분위기는 가장 좋지만 가격 freshness가 약합니다."
      },
      {
        "type": "purchase_option",
        "rank": 2,
        "option_type": "best_price",
        "tradeoff_type": "farther_but_cheaper",
        "place_id": "fixture_place_trade_002_002",
        "place_name": "Fixture Budget Pub",
        "beverage_name": "Fixture Bourbon Whiskey",
        "distance_m": 900,
        "price_krw": 38000,
        "atmosphere": "캐주얼하고 밝은 펍 분위기",
        "availability_status": "likely_available",
        "inventory_confidence": 0.86,
        "price_confidence": 0.86,
        "reason_codes": [
          "BEST_PRICE",
          "WITHIN_BUDGET"
        ],
        "explanation": "가격 신뢰도는 더 높고 가격이 낮습니다."
      }
    ],
    "missing_facts": [],
    "used_sources": [
      {
        "source_type": "purchase_option_recommendation",
        "source_service": "recommendation-service",
        "request_id": "fixture_rec_req_purchase_option_recommendation_002",
        "result_id": "fixture_rec_result_purchase_option_recommendation_002",
        "scoring_config_version": "fixture_scoring_v1",
        "profile_revision": 42
      }
    ]
  },
  "expected_assistant_behavior": {
    "answer_ko": "분위기만 보면 Fixture Mood Lounge가 더 좋습니다. 다만 가격 freshness가 약해서 46,000원 정보는 조심해서 봐야 합니다. 가격을 더 믿고 고르면 Fixture Budget Pub이 38,000원이고 가격 신뢰도도 더 높습니다.",
    "refused": false,
    "refusal_reason": "",
    "must_include": [
      "Fixture Mood Lounge",
      "680",
      "46,000원",
      "Fixture Budget Pub"
    ],
    "must_not_include": [
      "새로운 장소",
      "새로운 가격",
      "도보 시간",
      "실시간 재고 확정"
    ],
    "preserve_recommendation_order": true,
    "notes": "Expected answer must disclose uncertainty when confidence or freshness is weak."
  },
  "human_review": {
    "status": "draft",
    "reviewer": "",
    "notes": "Synthetic trade-off fixture for manual review.",
    "risk_flags": []
  }
}
