{
  "schema_version": "chatbot_sft_snapshot_v1",
  "snapshot_id": "sft_snap_tradeoff_explanation_004",
  "data_type": "tradeoff_explanation",
  "created_at": "2026-06-02T00:00:00+09:00",
  "language": "ko",
  "fixture_policy": {
    "is_synthetic_fixture": true,
    "is_training_example": false,
    "human_review_required": true
  },
  "source_policy": {
    "allowed_sources": [
      "recommendation-service purchase option output",
      "recommendation-service venue snapshot metadata",
      "recommendation-service price and distance facts"
    ],
    "disallowed_sources": [
      "direct map database rows",
      "unverified live inventory",
      "route time from model memory",
      "new price estimates"
    ],
    "pii_status": "no_pii",
    "raw_data_policy": "Only synthetic recommendation snapshot facts are present.",
    "ranking_policy": "Assistant may compare trade-offs but must not create new option labels or reorder ranked options."
  },
  "user_request": {
    "text_ko": "멀어도 가격이 좋으면 추천해줘.",
    "intent": "compare_purchase_options",
    "requires_location": true
  },
  "grounded_context": {
    "profile": {
      "status": "active",
      "profile_revision": 44,
      "summary_ko": "가격, 거리, 분위기를 함께 비교하려는 사용자입니다.",
      "preferred_categories": [
        "whiskey",
        "bar"
      ],
      "budget": "30k_100k"
    },
    "recommendations": [
      {
        "type": "purchase_option",
        "rank": 1,
        "option_type": "balanced_best",
        "tradeoff_type": "closer_but_more_expensive",
        "place_id": "fixture_place_trade_004_001",
        "place_name": "Fixture Balanced Cellar",
        "beverage_name": "Fixture Bourbon Whiskey",
        "distance_m": 620,
        "price_krw": 50000,
        "atmosphere": "조용하고 대화하기 좋은 분위기",
        "availability_status": "likely_available",
        "inventory_confidence": 0.82,
        "price_confidence": 0.82,
        "reason_codes": [
          "BALANCED_BEST",
          "WITHIN_BUDGET"
        ],
        "explanation": "균형은 좋지만 가격이 더 높습니다."
      },
      {
        "type": "purchase_option",
        "rank": 2,
        "option_type": "best_price",
        "tradeoff_type": "farther_but_cheaper",
        "place_id": "fixture_place_trade_004_002",
        "place_name": "Fixture Far Value Bottle Shop",
        "beverage_name": "Fixture Bourbon Whiskey",
        "distance_m": 1650,
        "price_krw": 35000,
        "atmosphere": "구매 중심의 조용한 매장 분위기",
        "availability_status": "likely_available",
        "inventory_confidence": 0.9,
        "price_confidence": 0.9,
        "reason_codes": [
          "BEST_PRICE",
          "WITHIN_BUDGET"
        ],
        "explanation": "거리는 멀지만 가격이 가장 낮습니다."
      }
    ],
    "missing_facts": [],
    "used_sources": [
      {
        "source_type": "purchase_option_recommendation",
        "source_service": "recommendation-service",
        "request_id": "fixture_rec_req_purchase_option_recommendation_004",
        "result_id": "fixture_rec_result_purchase_option_recommendation_004",
        "scoring_config_version": "fixture_scoring_v1",
        "profile_revision": 44
      }
    ]
  },
  "expected_assistant_behavior": {
    "answer_ko": "가격을 강하게 우선하면 Fixture Far Value Bottle Shop이 35,000원으로 가장 좋습니다. 다만 1,650m로 멀고 구매 중심 매장입니다. 균형을 원하면 620m 거리의 Fixture Balanced Cellar가 더 편하지만 가격은 50,000원입니다.",
    "refused": false,
    "refusal_reason": "",
    "must_include": [
      "Fixture Balanced Cellar",
      "620",
      "50,000원",
      "Fixture Far Value Bottle Shop"
    ],
    "must_not_include": [
      "새로운 장소",
      "새로운 가격",
      "도보 시간",
      "실시간 재고 확정"
    ],
    "preserve_recommendation_order": true,
    "notes": "Expected answer must disclose uncertainty when confidence or freshness is weak."
  },
  "human_review": {
    "status": "draft",
    "reviewer": "",
    "notes": "Synthetic trade-off fixture for manual review.",
    "risk_flags": []
  }
}
