{
  "schema_version": "chatbot_sft_snapshot_v1",
  "snapshot_id": "sft_snap_venue_recommendation_explanation_001",
  "data_type": "venue_recommendation_explanation",
  "created_at": "2026-06-02T00:00:00+09:00",
  "language": "ko",
  "fixture_policy": {
    "is_synthetic_fixture": true,
    "is_training_example": false,
    "human_review_required": true
  },
  "source_policy": {
    "allowed_sources": [
      "recommendation-service venue recommendation output",
      "recommendation-service map/place read-model snapshot",
      "recommendation-service reason codes"
    ],
    "disallowed_sources": [
      "direct map database rows",
      "Kakao response data outside approved policy",
      "auth tokens",
      "model memory"
    ],
    "pii_status": "no_pii",
    "raw_data_policy": "Only synthetic recommendation read-model facts are present.",
    "ranking_policy": "Assistant must preserve venue ranking and must not invent place facts."
  },
  "user_request": {
    "text_ko": "조용한 위스키 바 추천해줘.",
    "intent": "find_nearby_venue",
    "requires_location": true
  },
  "grounded_context": {
    "profile": {
      "status": "active",
      "profile_revision": 31,
      "summary_ko": "조용한 분위기와 위스키 메뉴를 선호합니다.",
      "preferred_categories": [
        "bar",
        "pub"
      ],
      "budget": "30k_100k"
    },
    "recommendations": [
      {
        "type": "venue",
        "rank": 1,
        "place_id": "fixture_place_venue_001_001",
        "name_en": "Fixture Oak Room",
        "display_name_ko": "픽스처 오크 룸",
        "place_name": "Fixture Oak Room",
        "place_type": "bar",
        "distance_m": 480,
        "atmosphere": "조용하고 어두운 위스키 바 분위기",
        "menu": [
          "버번 하이볼",
          "싱글몰트 샘플러"
        ],
        "price_range": "25000-50000",
        "availability_status": "likely_available",
        "inventory_confidence": 0.77,
        "price_confidence": 0.78,
        "reason_codes": [
          "NEARBY_VENUE",
          "GOOD_ATMOSPHERE",
          "MATCHES_RICH_OAK_PROFILE"
        ],
        "explanation": "가까운 거리와 조용한 위스키 바 분위기가 잘 맞습니다."
      },
      {
        "type": "venue",
        "rank": 2,
        "place_id": "fixture_place_venue_001_002",
        "name_en": "Fixture Barrel Pub",
        "display_name_ko": "픽스처 배럴 펍",
        "place_name": "Fixture Barrel Pub",
        "place_type": "pub",
        "distance_m": 820,
        "atmosphere": "캐주얼하고 대화하기 좋은 펍 분위기",
        "menu": [
          "하이볼",
          "라거"
        ],
        "price_range": "15000-30000",
        "availability_status": "likely_available",
        "inventory_confidence": 0.8,
        "price_confidence": 0.78,
        "reason_codes": [
          "BEGINNER_FRIENDLY",
          "NEARBY_VENUE"
        ],
        "explanation": "조금 더 캐주얼한 분위기의 대안입니다."
      }
    ],
    "missing_facts": [],
    "used_sources": [
      {
        "source_type": "venue_recommendation",
        "source_service": "recommendation-service",
        "request_id": "fixture_rec_req_venue_recommendation_001",
        "result_id": "fixture_rec_result_venue_recommendation_001",
        "scoring_config_version": "fixture_scoring_v1",
        "profile_revision": 31
      }
    ]
  },
  "expected_assistant_behavior": {
    "answer_ko": "조용한 위스키 바 기준이면 Fixture Oak Room이 가장 잘 맞습니다. 480m 거리이고 조용하고 어두운 위스키 바 분위기라서 취향과 잘 연결됩니다. 더 캐주얼한 대안으로는 820m 거리의 Fixture Barrel Pub이 있습니다.",
    "refused": false,
    "refusal_reason": "",
    "must_include": [
      "Fixture Oak Room",
      "480m",
      "조용하고 어두운",
      "Fixture Barrel Pub",
      "820m"
    ],
    "must_not_include": [
      "새로운 장소 이름",
      "영업 중 확정",
      "실시간 재고 확정",
      "도보 시간",
      "추천 순서 변경"
    ],
    "preserve_recommendation_order": true,
    "notes": "Expected answer must preserve venue ranking and avoid live availability claims."
  },
  "human_review": {
    "status": "draft",
    "reviewer": "",
    "notes": "Synthetic venue recommendation fixture for manual review.",
    "risk_flags": []
  }
}
